"No.","Time","Source","Destination","Protocol","Length","Info"
"1","0.000000","140.82.113.26","192.168.75.216","TCP","54","443  >  58291 [ACK] Seq=1 Ack=1 Win=210 Len=0"
"2","0.000000","157.240.208.60","192.168.75.216","TLSv1.2","92","Application Data"
"3","0.048745","192.168.75.216","157.240.208.60","TCP","54","58281  >  443 [ACK] Seq=1 Ack=39 Win=254 Len=0"
"6","1.423525","192.168.75.216","52.71.28.102","TCP","55","58005  >  443 [ACK] Seq=1 Ack=1 Win=255 Len=1 [TCP segment of a reassembled PDU]"
"15","1.760740","52.71.28.102","192.168.75.216","TCP","54","443  >  58005 [ACK] Seq=1 Ack=2 Win=170 Len=0"
"48","1.906118","192.168.75.216","108.138.141.32","TCP","55","58294  >  443 [ACK] Seq=1 Ack=1 Win=253 Len=1 [TCP segment of a reassembled PDU]"
"66","2.077273","108.138.141.32","192.168.75.216","TCP","54","443  >  58294 [ACK] Seq=1 Ack=2 Win=173 Len=0"
"507","4.117593","3.232.39.161","192.168.75.216","TLSv1.2","93","Application Data"
"508","4.123848","3.232.39.161","192.168.75.216","TLSv1.2","78","Application Data"
"509","4.123925","192.168.75.216","3.232.39.161","TCP","54","58299  >  443 [ACK] Seq=1 Ack=64 Win=255 Len=0"
"512","6.148453","192.168.75.216","157.240.208.60","TLSv1.2","180","Application Data"
"513","6.149133","3.232.39.161","192.168.75.216","TCP","54","443  >  58299 [FIN, ACK] Seq=64 Ack=1 Win=149 Len=0"
"514","6.149222","192.168.75.216","3.232.39.161","TCP","54","58299  >  443 [ACK] Seq=1 Ack=65 Win=255 Len=0"
"515","6.581119","192.168.75.216","157.240.208.60","TCP","180","[TCP Retransmission] 58281  >  443 [PSH, ACK] Seq=1 Ack=39 Win=254 Len=126"
"516","6.585288","157.240.208.60","192.168.75.216","TCP","54","443  >  58281 [ACK] Seq=39 Ack=127 Win=980 Len=0"
"517","6.743603","157.240.208.60","192.168.75.216","TCP","54","[TCP Dup ACK 516#1] 443  >  58281 [ACK] Seq=39 Ack=127 Win=980 Len=0"
"520","7.072713","3.225.133.12","192.168.75.216","TLSv1.2","85","Encrypted Alert"
"554","7.118290","192.168.75.216","3.225.133.12","TCP","54","58302  >  443 [ACK] Seq=1 Ack=32 Win=253 Len=0"
"557","8.147032","192.168.75.216","20.96.88.162","TLSv1.2","126","Application Data"
"558","8.147216","192.168.75.216","20.96.88.162","TLSv1.2","100","Application Data"
"559","8.147266","192.168.75.216","20.96.88.162","TLSv1.2","228","Application Data"
"561","8.452100","192.168.75.216","20.96.88.162","TCP","346","[TCP Retransmission] 58300  >  443 [PSH, ACK] Seq=1 Ack=1 Win=251 Len=292"
"562","8.456396","20.96.88.162","192.168.75.216","TCP","54","443  >  58300 [ACK] Seq=1 Ack=73 Win=951 Len=0"
"563","8.456396","20.96.88.162","192.168.75.216","TCP","54","443  >  58300 [ACK] Seq=1 Ack=293 Win=958 Len=0"
"564","8.457939","20.96.88.162","192.168.75.216","TLSv1.2","142","Application Data, Application Data"
"565","8.464542","20.96.88.162","192.168.75.216","TLSv1.2","131","Application Data"
"566","8.464689","192.168.75.216","20.96.88.162","TCP","54","58300  >  443 [ACK] Seq=293 Ack=166 Win=257 Len=0"
"567","10.244439","20.205.243.166","192.168.75.216","TLSv1.2","93","Application Data"
"568","10.244439","20.205.243.166","192.168.75.216","TCP","54","443  >  58284 [FIN, ACK] Seq=40 Ack=1 Win=149 Len=0"
"569","10.244601","192.168.75.216","20.205.243.166","TCP","54","58284  >  443 [ACK] Seq=1 Ack=41 Win=256 Len=0"
"570","12.085624","3.225.133.12","192.168.75.216","TCP","54","443  >  58302 [FIN, ACK] Seq=32 Ack=1 Win=178 Len=0"
"571","12.085737","192.168.75.216","3.225.133.12","TCP","54","58302  >  443 [ACK] Seq=1 Ack=33 Win=253 Len=0"
"572","12.785429","140.82.113.26","192.168.75.216","TLSv1.2","79","Application Data"
"573","12.785697","192.168.75.216","140.82.113.26","TLSv1.2","83","Application Data"
"575","12.918481","140.82.113.26","192.168.75.216","TCP","54","443  >  58291 [ACK] Seq=26 Ack=30 Win=211 Len=0"
"625","15.887016","192.168.75.216","58.251.106.185","TCP","66","58303  >  443 [SYN] Seq=0 Win=65535 Len=0 MSS=1460 WS=2 SACK_PERM=1"
"629","15.994742","58.251.106.185","192.168.75.216","TCP","66","443  >  58303 [SYN, ACK] Seq=0 Ack=1 Win=4200 Len=0 MSS=1400 WS=32 SACK_PERM=1"
"630","15.995136","192.168.75.216","58.251.106.185","TCP","54","58303  >  443 [ACK] Seq=1 Ack=1 Win=65536 Len=0"
"631","15.995234","192.168.75.216","58.251.106.185","TCP","352","58303  >  443 [PSH, ACK] Seq=1 Ack=1 Win=65536 Len=298 [TCP segment of a reassembled PDU]"
"633","15.996592","192.168.75.216","101.33.47.206","TCP","66","58304  >  8081 [SYN] Seq=0 Win=65535 Len=0 MSS=1460 WS=2 SACK_PERM=1"
"634","15.996648","192.168.75.216","101.33.47.206","TCP","66","58305  >  8081 [SYN] Seq=0 Win=65535 Len=0 MSS=1460 WS=2 SACK_PERM=1"
"636","16.196796","192.168.75.216","101.33.47.206","TCP","66","58306  >  8081 [SYN] Seq=0 Win=65535 Len=0 MSS=1460 WS=2 SACK_PERM=1"
"637","16.202887","101.33.47.206","192.168.75.216","TCP","66","8081  >  58305 [SYN, ACK] Seq=0 Ack=1 Win=4200 Len=0 MSS=1400 WS=32 SACK_PERM=1"
"638","16.202887","101.33.47.206","192.168.75.216","TCP","66","8081  >  58304 [SYN, ACK] Seq=0 Ack=1 Win=4200 Len=0 MSS=1400 WS=32 SACK_PERM=1"
"639","16.203068","192.168.75.216","101.33.47.206","TCP","54","58305  >  8081 [ACK] Seq=1 Ack=1 Win=65536 Len=0"
"640","16.203095","192.168.75.216","101.33.47.206","TCP","1089","58305  >  8081 [PSH, ACK] Seq=1 Ack=1 Win=65536 Len=1035"
"641","16.203128","192.168.75.216","101.33.47.206","TCP","1073","58304  >  8081 [PSH, ACK] Seq=1 Ack=1 Win=65536 Len=1019"
"642","16.203178","192.168.75.216","101.33.47.206","TCP","54","58304  >  8081 [FIN, ACK] Seq=1020 Ack=1 Win=65536 Len=0"
"643","16.203205","192.168.75.216","101.33.47.206","TCP","54","58305  >  8081 [FIN, ACK] Seq=1036 Ack=1 Win=65536 Len=0"
"644","16.324981","192.168.75.216","58.251.106.185","TCP","352","[TCP Retransmission] 58303  >  443 [PSH, ACK] Seq=1 Ack=1 Win=65536 Len=298"
"645","16.326580","101.33.47.206","192.168.75.216","TCP","66","8081  >  58306 [SYN, ACK] Seq=0 Ack=1 Win=4200 Len=0 MSS=1400 WS=32 SACK_PERM=1"
"646","16.326580","101.33.47.206","192.168.75.216","TCP","54","8081  >  58305 [ACK] Seq=1 Ack=1036 Win=5216 Len=0"
"647","16.327061","192.168.75.216","101.33.47.206","TCP","54","58306  >  8081 [ACK] Seq=1 Ack=1 Win=65536 Len=0"
"648","16.327110","192.168.75.216","101.33.47.206","TCP","1137","58306  >  8081 [PSH, ACK] Seq=1 Ack=1 Win=65536 Len=1083"
"649","16.327222","192.168.75.216","101.33.47.206","TCP","54","58306  >  8081 [FIN, ACK] Seq=1084 Ack=1 Win=65536 Len=0"
"650","16.327630","101.33.47.206","192.168.75.216","TCP","54","8081  >  58304 [ACK] Seq=1 Ack=1020 Win=5216 Len=0"
"651","16.327630","101.33.47.206","192.168.75.216","TCP","276","8081  >  58304 [PSH, ACK] Seq=1 Ack=1020 Win=5216 Len=222"
"652","16.327630","101.33.47.206","192.168.75.216","TCP","54","8081  >  58304 [FIN, ACK] Seq=223 Ack=1020 Win=5216 Len=0"
"653","16.327630","101.33.47.206","192.168.75.216","TCP","276","8081  >  58305 [PSH, ACK] Seq=1 Ack=1036 Win=5216 Len=222"
"654","16.327630","101.33.47.206","192.168.75.216","TCP","54","8081  >  58305 [FIN, ACK] Seq=223 Ack=1036 Win=5216 Len=0"
"655","16.327833","192.168.75.216","101.33.47.206","TCP","54","58304  >  8081 [ACK] Seq=1021 Ack=224 Win=65314 Len=0"
"656","16.327955","192.168.75.216","101.33.47.206","TCP","54","58305  >  8081 [ACK] Seq=1037 Ack=224 Win=65314 Len=0"
"657","16.471563","192.168.75.216","13.236.8.150","TCP","55","58221  >  443 [ACK] Seq=1 Ack=1 Win=256 Len=1 [TCP segment of a reassembled PDU]"
"658","16.476377","58.251.106.185","192.168.75.216","TCP","54","443  >  58303 [ACK] Seq=1 Ack=299 Win=4480 Len=0"
"659","16.476377","101.33.47.206","192.168.75.216","TCP","54","8081  >  58306 [ACK] Seq=1 Ack=1084 Win=5280 Len=0"
"660","16.476525","101.33.47.206","192.168.75.216","TCP","276","8081  >  58306 [PSH, ACK] Seq=1 Ack=1084 Win=5280 Len=222"
"661","16.477453","101.33.47.206","192.168.75.216","TCP","54","8081  >  58306 [FIN, ACK] Seq=223 Ack=1084 Win=5280 Len=0"
"662","16.477537","192.168.75.216","101.33.47.206","TCP","54","58306  >  8081 [ACK] Seq=1085 Ack=224 Win=65314 Len=0"
"663","16.809749","13.236.8.150","192.168.75.216","TCP","54","443  >  58221 [ACK] Seq=1 Ack=2 Win=216 Len=0"
"664","16.814937","192.168.75.216","101.33.47.206","TCP","54","[TCP Retransmission] 58306  >  8081 [FIN, ACK] Seq=1084 Ack=224 Win=65314 Len=0"
"665","16.903711","192.168.75.216","101.33.47.206","TCP","54","[TCP Retransmission] 58305  >  8081 [FIN, ACK] Seq=1036 Ack=224 Win=65314 Len=0"
"666","16.904655","58.251.106.185","192.168.75.216","TCP","74","443  >  58303 [PSH, ACK] Seq=1 Ack=299 Win=4480 Len=20 [TCP segment of a reassembled PDU]"
"667","16.904655","101.33.47.206","192.168.75.216","TCP","54","8081  >  58306 [ACK] Seq=224 Ack=1085 Win=5280 Len=0"
"668","16.904877","192.168.75.216","58.251.106.185","TCP","392","58303  >  443 [PSH, ACK] Seq=299 Ack=21 Win=65516 Len=338 [TCP segment of a reassembled PDU]"
"669","16.911693","192.168.75.216","101.33.47.206","TCP","54","[TCP Retransmission] 58304  >  8081 [FIN, ACK] Seq=1020 Ack=224 Win=65314 Len=0"
"670","17.220858","192.168.75.216","58.251.106.185","TCP","392","[TCP Retransmission] 58303  >  443 [PSH, ACK] Seq=299 Ack=21 Win=65516 Len=338"
"671","17.224769","101.33.47.206","192.168.75.216","TCP","54","8081  >  58305 [ACK] Seq=224 Ack=1037 Win=5216 Len=0"
"672","17.224769","101.33.47.206","192.168.75.216","TCP","54","8081  >  58304 [ACK] Seq=224 Ack=1021 Win=5216 Len=0"
"673","17.224956","58.251.106.185","192.168.75.216","TCP","54","443  >  58303 [ACK] Seq=21 Ack=637 Win=4832 Len=0"
"675","18.013132","58.251.106.185","192.168.75.216","TCP","54","[TCP Dup ACK 673#1] 443  >  58303 [ACK] Seq=21 Ack=637 Win=4832 Len=0"
"676","18.013132","58.251.106.185","192.168.75.216","TCP","74","443  >  58303 [PSH, ACK] Seq=21 Ack=637 Win=4832 Len=20 [TCP segment of a reassembled PDU]"
"677","18.013376","192.168.75.216","58.251.106.185","TCP","392","58303  >  443 [PSH, ACK] Seq=637 Ack=41 Win=65496 Len=338 [TCP segment of a reassembled PDU]"
"678","18.013496","140.82.114.21","192.168.75.216","TLSv1.2","93","Application Data"
"679","18.013496","140.82.114.21","192.168.75.216","TCP","54","443  >  58293 [FIN, ACK] Seq=40 Ack=1 Win=292 Len=0"
"680","18.013587","192.168.75.216","140.82.114.21","TCP","54","58293  >  443 [ACK] Seq=1 Ack=41 Win=256 Len=0"
"681","18.013835","192.168.75.216","140.82.114.21","TCP","54","58293  >  443 [FIN, ACK] Seq=1 Ack=41 Win=256 Len=0"
"682","18.146137","192.168.75.216","3.233.149.199","TLSv1.2","277","Application Data"
"683","18.146270","192.168.75.216","3.233.149.199","TLSv1.2","100","Application Data"
"684","18.146327","192.168.75.216","3.233.149.199","TLSv1.2","1335","Application Data"
"685","18.147014","140.82.114.21","192.168.75.216","TCP","54","443  >  58293 [ACK] Seq=41 Ack=2 Win=292 Len=0"
"686","18.147014","58.251.106.185","192.168.75.216","TCP","54","443  >  58303 [ACK] Seq=41 Ack=975 Win=5152 Len=0"
"724","18.216762","3.233.149.199","192.168.75.216","TCP","54","443  >  58279 [ACK] Seq=1 Ack=224 Win=610 Len=0"
"725","18.216762","3.233.149.199","192.168.75.216","TCP","54","443  >  58279 [ACK] Seq=1 Ack=1551 Win=651 Len=0"
"728","18.809497","3.233.149.199","192.168.75.216","TLSv1.2","100","Application Data"
"729","18.809741","3.233.149.199","192.168.75.216","TLSv1.2","199","Application Data"
"730","18.809741","3.233.149.199","192.168.75.216","TLSv1.2","92","Application Data"
"731","18.809741","58.251.106.185","192.168.75.216","TCP","74","443  >  58303 [PSH, ACK] Seq=41 Ack=975 Win=5152 Len=20 [TCP segment of a reassembled PDU]"
"732","18.809855","192.168.75.216","3.233.149.199","TCP","54","58279  >  443 [ACK] Seq=1551 Ack=230 Win=255 Len=0"
"733","18.811045","192.168.75.216","3.233.149.199","TLSv1.2","96","Application Data"
"734","18.868086","192.168.75.216","58.251.106.185","TCP","54","58303  >  443 [ACK] Seq=975 Ack=61 Win=65476 Len=0"
"735","19.169637","192.168.75.216","74.125.200.188","TCP","55","[TCP segment of a reassembled PDU]"
"736","19.170737","3.233.149.199","192.168.75.216","TCP","54","443  >  58279 [ACK] Seq=230 Ack=1593 Win=652 Len=0"
"737","19.170737","3.232.39.161","192.168.75.216","TLSv1.2","93","Application Data"
"738","19.170892","3.232.39.161","192.168.75.216","TLSv1.2","78","Application Data"
"739","19.170937","192.168.75.216","3.232.39.161","TCP","54","58295  >  443 [ACK] Seq=1 Ack=64 Win=254 Len=0"
"740","19.171064","192.168.75.216","3.232.39.161","TCP","54","58295  >  443 [FIN, ACK] Seq=1 Ack=64 Win=254 Len=0"
"741","19.221027","192.168.75.216","18.211.189.31","TCP","55","58216  >  443 [ACK] Seq=1 Ack=1 Win=252 Len=1 [TCP segment of a reassembled PDU]"
"742","19.226095","3.232.39.161","192.168.75.216","TCP","54","443  >  58295 [ACK] Seq=64 Ack=2 Win=219 Len=0"
"743","19.602976","74.125.200.188","192.168.75.216","TCP","54","5228  >  57907 [ACK] Seq=1 Ack=2 Win=156 Len=0"
"744","19.602976","18.211.189.31","192.168.75.216","TCP","54","443  >  58216 [ACK] Seq=1 Ack=2 Win=187 Len=0"
"745","19.603137","3.232.39.161","192.168.75.216","TCP","54","443  >  58295 [FIN, ACK] Seq=64 Ack=2 Win=219 Len=0"
"746","19.603225","192.168.75.216","3.232.39.161","TCP","54","58295  >  443 [ACK] Seq=2 Ack=65 Win=254 Len=0"
"747","20.028470","192.168.75.216","58.251.106.185","TCP","54","58303  >  443 [FIN, ACK] Seq=975 Ack=61 Win=65476 Len=0"
"748","20.330278","192.168.75.216","58.251.106.185","TCP","54","[TCP Retransmission] 58303  >  443 [FIN, ACK] Seq=975 Ack=61 Win=65476 Len=0"
"749","20.334259","58.251.106.185","192.168.75.216","TCP","54","443  >  58303 [ACK] Seq=61 Ack=976 Win=5152 Len=0"
"750","20.439588","192.168.75.216","20.205.243.166","TCP","55","58283  >  443 [ACK] Seq=1 Ack=1 Win=257 Len=1 [TCP segment of a reassembled PDU]"
"751","20.444342","58.251.106.185","192.168.75.216","TCP","54","[TCP Dup ACK 749#1] 443  >  58303 [ACK] Seq=61 Ack=976 Win=5152 Len=0"
"752","20.816627","58.251.106.185","192.168.75.216","TCP","54","443  >  58303 [FIN, ACK] Seq=61 Ack=976 Win=5152 Len=0"
"753","20.816627","20.205.243.166","192.168.75.216","TCP","54","443  >  58283 [ACK] Seq=1 Ack=2 Win=530 Len=0"
"754","20.816774","192.168.75.216","58.251.106.185","TCP","54","58303  >  443 [ACK] Seq=976 Ack=62 Win=65476 Len=0"
"755","21.284597","192.168.75.216","185.199.108.133","TCP","55","57953  >  443 [ACK] Seq=1 Ack=1 Win=257 Len=1 [TCP segment of a reassembled PDU]"
"756","22.635050","185.199.108.133","192.168.75.216","TCP","54","443  >  57953 [ACK] Seq=1 Ack=2 Win=206 Len=0"
"802","23.617850","192.168.75.216","142.251.10.95","TCP","55","58149  >  443 [ACK] Seq=1 Ack=1 Win=254 Len=1 [TCP segment of a reassembled PDU]"
"804","24.682956","142.251.10.95","192.168.75.216","TCP","54","443  >  58149 [ACK] Seq=1 Ack=2 Win=149 Len=0"
"806","27.596832","192.168.75.216","185.199.108.154","TCP","55","58282  >  443 [ACK] Seq=1 Ack=1 Win=255 Len=1 [TCP segment of a reassembled PDU]"
"812","27.636157","185.199.108.154","192.168.75.216","TCP","54","443  >  58282 [ACK] Seq=1 Ack=2 Win=149 Len=0"
"861","31.142458","192.168.75.216","13.236.8.150","TLSv1.2","123","Ignored Unknown Record"
"862","31.142618","192.168.75.216","13.236.8.150","TLSv1.2","93","Application Data"
"863","31.639220","192.168.75.216","13.236.8.150","TCP","162","[TCP Retransmission] 58221  >  443 [PSH, ACK] Seq=2 Ack=1 Win=256 Len=108"
"864","31.640210","13.236.8.150","192.168.75.216","TCP","54","443  >  58221 [ACK] Seq=1 Ack=110 Win=219 Len=0"
"865","31.640210","13.236.8.150","192.168.75.216","TLSv1.2","137","Application Data"
"866","31.679206","192.168.75.216","20.205.243.168","TCP","55","58292  >  443 [ACK] Seq=1 Ack=1 Win=257 Len=1 [TCP segment of a reassembled PDU]"
"867","31.695217","192.168.75.216","13.236.8.150","TCP","54","58221  >  443 [ACK] Seq=110 Ack=84 Win=256 Len=0"
"868","31.970104","192.168.75.216","3.94.218.138","TCP","55","58124  >  443 [ACK] Seq=1 Ack=1 Win=257 Len=1 [TCP segment of a reassembled PDU]"
"869","31.974361","20.205.243.168","192.168.75.216","TCP","54","443  >  58292 [ACK] Seq=1 Ack=2 Win=1193 Len=0"
"870","32.172799","192.168.75.216","185.199.108.154","TCP","55","58285  >  443 [ACK] Seq=1 Ack=1 Win=254 Len=1 [TCP segment of a reassembled PDU]"
"871","32.176755","3.94.218.138","192.168.75.216","TCP","54","443  >  58124 [ACK] Seq=1 Ack=2 Win=249 Len=0"
"874","32.482246","185.199.108.154","192.168.75.216","TCP","54","443  >  58285 [ACK] Seq=1 Ack=2 Win=199 Len=0"
"875","32.681751","192.168.75.216","34.193.113.164","TCP","55","58125  >  443 [ACK] Seq=1 Ack=1 Win=256 Len=1 [TCP segment of a reassembled PDU]"
"887","32.724062","34.193.113.164","192.168.75.216","TCP","54","443  >  58125 [ACK] Seq=1 Ack=2 Win=320 Len=0"
"889","34.153248","192.168.75.216","18.211.189.31","TLSv1.2","122","Ignored Unknown Record"
"891","34.254516","18.211.189.31","192.168.75.216","TCP","54","443  >  58216 [ACK] Seq=1 Ack=70 Win=189 Len=0"
"974","34.453822","18.211.189.31","192.168.75.216","TLSv1.2","120","Application Data"
"976","34.508586","192.168.75.216","18.211.189.31","TCP","54","58216  >  443 [ACK] Seq=70 Ack=67 Win=252 Len=0"
"1051","34.647654","192.168.75.216","35.171.96.214","TCP","55","58298  >  443 [ACK] Seq=1 Ack=1 Win=256 Len=1 [TCP segment of a reassembled PDU]"
"1052","34.647657","192.168.75.216","35.171.96.214","TCP","55","58296  >  443 [ACK] Seq=1 Ack=1 Win=257 Len=1 [TCP segment of a reassembled PDU]"
"1103","34.711737","35.171.96.214","192.168.75.216","TCP","54","443  >  58298 [ACK] Seq=1 Ack=2 Win=151 Len=0"
"1110","34.713186","35.171.96.214","192.168.75.216","TCP","54","443  >  58296 [ACK] Seq=1 Ack=2 Win=274 Len=0"
"1408","35.391271","192.168.75.216","35.171.96.214","TCP","55","58297  >  443 [ACK] Seq=1 Ack=1 Win=257 Len=1 [TCP segment of a reassembled PDU]"
"1409","35.446715","35.171.96.214","192.168.75.216","TCP","54","443  >  58297 [ACK] Seq=1 Ack=2 Win=274 Len=0"
"1410","36.087630","192.168.75.216","20.96.88.162","TCP","55","58301  >  443 [ACK] Seq=1 Ack=1 Win=255 Len=1 [TCP segment of a reassembled PDU]"
"1411","36.164973","20.96.88.162","192.168.75.216","TCP","54","443  >  58301 [ACK] Seq=1 Ack=2 Win=152 Len=0"
"1496","42.564488","192.168.75.216","52.98.66.98","TCP","55","58048  >  443 [ACK] Seq=1 Ack=1 Win=252 Len=1 [TCP segment of a reassembled PDU]"
"1497","42.897272","52.98.66.98","192.168.75.216","TCP","54","443  >  58048 [ACK] Seq=1 Ack=2 Win=264 Len=0"
"1618","46.772963","192.168.75.216","52.71.28.102","TCP","55","[TCP Keep-Alive] 58005  >  443 [ACK] Seq=1 Ack=1 Win=255 Len=1"
"1621","47.079349","192.168.75.216","108.138.141.32","TCP","55","[TCP Keep-Alive] 58294  >  443 [ACK] Seq=1 Ack=1 Win=253 Len=1"
"1622","47.083399","52.71.28.102","192.168.75.216","TCP","54","[TCP Keep-Alive ACK] 443  >  58005 [ACK] Seq=1 Ack=2 Win=170 Len=0"
"1623","48.337583","108.138.141.32","192.168.75.216","TCP","54","[TCP Keep-Alive ACK] 443  >  58294 [ACK] Seq=1 Ack=2 Win=173 Len=0"
"1624","49.141477","192.168.75.216","3.233.149.199","TLSv1.2","277","Application Data"
"1625","49.141626","192.168.75.216","3.233.149.199","TLSv1.2","100","Application Data"
"1626","49.141691","192.168.75.216","3.233.149.199","TLSv1.2","1358","Application Data"
"1628","49.477446","3.233.149.199","192.168.75.216","TCP","54","443  >  58279 [ACK] Seq=230 Ack=1862 Win=661 Len=0"
"1629","49.477446","3.233.149.199","192.168.75.216","TCP","54","443  >  58279 [ACK] Seq=230 Ack=3166 Win=702 Len=0"
"1630","49.670579","3.233.149.199","192.168.75.216","TLSv1.2","100","Application Data"
"1631","49.670579","3.233.149.199","192.168.75.216","TLSv1.2","199","Application Data"
"1632","49.670710","192.168.75.216","3.233.149.199","TCP","54","58279  >  443 [ACK] Seq=3166 Ack=421 Win=255 Len=0"
"1633","49.670831","3.233.149.199","192.168.75.216","TLSv1.2","92","Application Data"
"1665","49.672873","192.168.75.216","3.233.149.199","TLSv1.2","96","Application Data"
"1698","50.201155","192.168.75.216","3.233.149.199","TCP","96","[TCP Retransmission] 58279  >  443 [PSH, ACK] Seq=3166 Ack=459 Win=255 Len=42"
"1700","50.205137","3.233.149.199","192.168.75.216","TCP","54","443  >  58279 [ACK] Seq=459 Ack=3208 Win=703 Len=0"
"1702","50.205528","20.205.243.166","192.168.75.216","TLSv1.2","93","Application Data"
"1703","50.205528","20.205.243.166","192.168.75.216","TCP","54","443  >  58283 [FIN, ACK] Seq=40 Ack=2 Win=530 Len=0"
"1704","50.205636","192.168.75.216","20.205.243.166","TCP","54","58283  >  443 [ACK] Seq=2 Ack=41 Win=256 Len=0"
"1705","50.205795","192.168.75.216","20.205.243.166","TCP","54","58283  >  443 [FIN, ACK] Seq=2 Ack=41 Win=256 Len=0"
"1706","50.831422","192.168.75.216","20.205.243.166","TCP","54","[TCP Retransmission] 58283  >  443 [FIN, ACK] Seq=2 Ack=41 Win=256 Len=0"
"1707","50.835328","3.233.149.199","192.168.75.216","TCP","54","[TCP Dup ACK 1700#1] 443  >  58279 [ACK] Seq=459 Ack=3208 Win=703 Len=0"
"1708","50.835328","20.205.243.166","192.168.75.216","TCP","54","443  >  58283 [ACK] Seq=41 Ack=3 Win=530 Len=0"
"1710","51.161065","192.168.75.216","3.232.39.161","TCP","55","[TCP Keep-Alive] 58299  >  443 [ACK] Seq=0 Ack=65 Win=255 Len=1"
"1711","51.165689","20.205.243.166","192.168.75.216","TCP","54","[TCP Dup ACK 1708#1] 443  >  58283 [ACK] Seq=41 Ack=3 Win=530 Len=0"
"1712","51.756914","192.168.75.216","157.240.208.60","TCP","55","[TCP Keep-Alive] 58281  >  443 [ACK] Seq=126 Ack=39 Win=254 Len=1"
"1713","51.765200","3.232.39.161","192.168.75.216","TCP","54","[TCP Keep-Alive ACK] 443  >  58299 [ACK] Seq=65 Ack=1 Win=149 Len=0"
"1714","52.740060","157.240.208.60","192.168.75.216","TCP","54","[TCP Keep-Alive ACK] 443  >  58281 [ACK] Seq=39 Ack=127 Win=980 Len=0"
"1717","53.471295","192.168.75.216","20.96.88.162","TCP","55","[TCP Keep-Alive] 58300  >  443 [ACK] Seq=292 Ack=166 Win=257 Len=1"
"1718","54.686381","20.96.88.162","192.168.75.216","TCP","54","[TCP Keep-Alive ACK] 443  >  58300 [ACK] Seq=166 Ack=293 Win=958 Len=0"
"1719","55.246349","192.168.75.216","20.205.243.166","TCP","55","[TCP Keep-Alive] 58284  >  443 [ACK] Seq=0 Ack=41 Win=256 Len=1"
"1721","55.505042","20.205.243.166","192.168.75.216","TCP","54","[TCP Keep-Alive ACK] 443  >  58284 [ACK] Seq=41 Ack=1 Win=149 Len=0"
"1816","57.091524","192.168.75.216","3.225.133.12","TCP","55","[TCP Keep-Alive] 58302  >  443 [ACK] Seq=0 Ack=33 Win=253 Len=1"
"1817","57.924792","192.168.75.216","140.82.113.26","TCP","55","[TCP Keep-Alive] 58291  >  443 [ACK] Seq=29 Ack=26 Win=253 Len=1"
"1818","57.929319","3.225.133.12","192.168.75.216","TCP","54","[TCP Keep-Alive ACK] 443  >  58302 [ACK] Seq=33 Ack=1 Win=178 Len=0"
"1819","58.967469","140.82.113.26","192.168.75.216","TCP","54","[TCP Keep-Alive ACK] 443  >  58291 [ACK] Seq=26 Ack=30 Win=211 Len=0"
"2059","61.144965","20.205.243.168","192.168.75.216","TLSv1.2","93","Application Data"
"2066","61.145285","20.205.243.168","192.168.75.216","TCP","54","443  >  58292 [FIN, ACK] Seq=40 Ack=2 Win=1193 Len=0"
"2069","61.145495","192.168.75.216","20.205.243.168","TCP","54","58292  >  443 [FIN, ACK] Seq=2 Ack=40 Win=256 Len=0"
"2070","61.145603","192.168.75.216","20.205.243.168","TCP","54","58292  >  443 [ACK] Seq=3 Ack=41 Win=256 Len=0"
"2195","61.201171","20.205.243.168","192.168.75.216","TCP","54","443  >  58292 [ACK] Seq=41 Ack=3 Win=1193 Len=0"
"2274","64.610133","192.168.75.216","74.125.200.188","TCP","55","[TCP Keep-Alive] 57907  >  5228 [ACK] Seq=1 Ack=1 Win=253 Len=1"
"2275","64.658911","74.125.200.188","192.168.75.216","TCP","54","[TCP Keep-Alive ACK] 5228  >  57907 [ACK] Seq=1 Ack=2 Win=156 Len=0"
"2335","66.929429","20.96.88.162","192.168.75.216","TCP","54","443  >  58301 [RST, ACK] Seq=1 Ack=2 Win=0 Len=0"
"2336","67.636433","192.168.75.216","185.199.108.133","TCP","55","[TCP Keep-Alive] 57953  >  443 [ACK] Seq=1 Ack=1 Win=257 Len=1"
"2338","68.506720","185.199.108.133","192.168.75.216","TCP","54","[TCP Keep-Alive ACK] 443  >  57953 [ACK] Seq=1 Ack=2 Win=206 Len=0"
"2339","69.687300","192.168.75.216","142.251.10.95","TCP","55","[TCP Keep-Alive] 58149  >  443 [ACK] Seq=1 Ack=1 Win=254 Len=1"
"2340","69.691636","157.240.208.60","192.168.75.216","TLSv1.2","171","Application Data"
"2343","69.743364","192.168.75.216","157.240.208.60","TCP","54","58281  >  443 [ACK] Seq=127 Ack=156 Win=253 Len=0"
"2344","69.748114","142.251.10.95","192.168.75.216","TCP","54","[TCP Keep-Alive ACK] 443  >  58149 [ACK] Seq=1 Ack=2 Win=149 Len=0"
"2345","70.152815","192.168.75.216","20.96.88.162","TLSv1.2","126","Application Data"
"2346","70.152966","192.168.75.216","20.96.88.162","TLSv1.2","100","Application Data"
"2347","70.153033","192.168.75.216","20.96.88.162","TLSv1.2","230","Application Data"
"2348","70.460665","192.168.75.216","20.96.88.162","TCP","348","[TCP Retransmission] 58300  >  443 [PSH, ACK] Seq=293 Ack=166 Win=257 Len=294"
"2349","70.464547","20.96.88.162","192.168.75.216","TCP","54","443  >  58300 [ACK] Seq=166 Ack=365 Win=960 Len=0"
"2350","70.464547","20.96.88.162","192.168.75.216","TCP","54","443  >  58300 [ACK] Seq=166 Ack=587 Win=967 Len=0"
"2351","70.465426","20.96.88.162","192.168.75.216","TLSv1.2","142","Application Data, Application Data"
"2352","70.465426","20.96.88.162","192.168.75.216","TLSv1.2","131","Application Data"
"2353","70.465487","192.168.75.216","20.96.88.162","TCP","54","58300  >  443 [ACK] Seq=587 Ack=331 Win=256 Len=0"
"2355","70.815483","20.96.88.162","192.168.75.216","TCP","54","[TCP Dup ACK 2350#1] 443  >  58300 [ACK] Seq=331 Ack=587 Win=967 Len=0"
"2417","72.482508","140.82.113.26","192.168.75.216","TLSv1.2","79","Application Data"
"2418","72.482723","192.168.75.216","140.82.113.26","TLSv1.2","83","Application Data"
"2421","72.573650","140.82.113.26","192.168.75.216","TCP","54","443  >  58291 [ACK] Seq=51 Ack=59 Win=212 Len=0"
"2437","72.649989","192.168.75.216","185.199.108.154","TCP","55","[TCP Keep-Alive] 58282  >  443 [ACK] Seq=1 Ack=1 Win=255 Len=1"
"2445","72.921229","185.199.108.154","192.168.75.216","TCP","54","[TCP Keep-Alive ACK] 443  >  58282 [ACK] Seq=1 Ack=2 Win=149 Len=0"
"2461","76.647503","192.168.75.216","13.236.8.150","TCP","55","[TCP Keep-Alive] 58221  >  443 [ACK] Seq=109 Ack=84 Win=256 Len=1"
"2463","76.901418","13.236.8.150","192.168.75.216","TCP","54","[TCP Keep-Alive ACK] 443  >  58221 [ACK] Seq=84 Ack=110 Win=219 Len=0"
"2520","77.191068","192.168.75.216","3.94.218.138","TCP","55","[TCP Keep-Alive] 58124  >  443 [ACK] Seq=1 Ack=1 Win=257 Len=1"
"2521","77.491336","192.168.75.216","185.199.108.154","TCP","55","[TCP Keep-Alive] 58285  >  443 [ACK] Seq=1 Ack=1 Win=254 Len=1"
"2522","77.495287","3.94.218.138","192.168.75.216","TCP","54","[TCP Keep-Alive ACK] 443  >  58124 [ACK] Seq=1 Ack=2 Win=249 Len=0"
"2523","77.735169","192.168.75.216","34.193.113.164","TCP","55","[TCP Keep-Alive] 58125  >  443 [ACK] Seq=1 Ack=1 Win=256 Len=1"
"2524","77.739625","185.199.108.154","192.168.75.216","TCP","54","[TCP Keep-Alive ACK] 443  >  58285 [ACK] Seq=1 Ack=2 Win=199 Len=0"
"2525","78.541627","34.193.113.164","192.168.75.216","TCP","54","[TCP Keep-Alive ACK] 443  >  58125 [ACK] Seq=1 Ack=2 Win=320 Len=0"
"2526","79.153766","192.168.75.216","3.233.149.199","TLSv1.2","273","Application Data"
"2527","79.153916","192.168.75.216","3.233.149.199","TLSv1.2","100","Application Data"
"2528","79.153982","192.168.75.216","3.233.149.199","TLSv1.2","1335","Application Data"
"2529","79.458519","192.168.75.216","18.211.189.31","TCP","55","[TCP Keep-Alive] 58216  >  443 [ACK] Seq=69 Ack=67 Win=252 Len=1[Reassembly error, protocol TCP: New fragment overlaps old data (retransmission?)]"
"2530","79.459294","3.233.149.199","192.168.75.216","TCP","54","443  >  58279 [ACK] Seq=459 Ack=3473 Win=711 Len=0"
"2531","79.459294","3.233.149.199","192.168.75.216","TCP","54","443  >  58279 [ACK] Seq=459 Ack=4754 Win=751 Len=0"
"2532","79.459577","3.233.149.199","192.168.75.216","TLSv1.2","100","Application Data"
"2533","79.500891","192.168.75.216","3.233.149.199","TCP","54","58279  >  443 [ACK] Seq=4754 Ack=505 Win=254 Len=0"
"2534","79.713897","192.168.75.216","35.171.96.214","TCP","55","[TCP Keep-Alive] 58296  >  443 [ACK] Seq=1 Ack=1 Win=257 Len=1"
"2535","79.714059","192.168.75.216","35.171.96.214","TCP","55","[TCP Keep-Alive] 58298  >  443 [ACK] Seq=1 Ack=1 Win=256 Len=1"
"2536","79.726718","18.211.189.31","192.168.75.216","TCP","54","[TCP Keep-Alive ACK] 443  >  58216 [ACK] Seq=67 Ack=70 Win=189 Len=0"
"2537","79.726718","3.233.149.199","192.168.75.216","TLSv1.2","199","Application Data"
"2538","79.726886","3.233.149.199","192.168.75.216","TLSv1.2","92","Application Data"
"2539","79.726938","192.168.75.216","3.233.149.199","TCP","54","58279  >  443 [ACK] Seq=4754 Ack=688 Win=254 Len=0"
"2540","79.728100","192.168.75.216","3.233.149.199","TLSv1.2","96","Application Data"
"2541","80.289818","192.168.75.216","3.233.149.199","TCP","96","[TCP Retransmission] 58279  >  443 [PSH, ACK] Seq=4754 Ack=688 Win=254 Len=42"
"2542","80.293926","3.233.149.199","192.168.75.216","TCP","54","443  >  58279 [ACK] Seq=688 Ack=4796 Win=753 Len=0"
"2543","80.293926","35.171.96.214","192.168.75.216","TCP","54","[TCP Keep-Alive ACK] 443  >  58298 [ACK] Seq=1 Ack=2 Win=151 Len=0"
"2544","80.447491","192.168.75.216","35.171.96.214","TCP","55","[TCP Keep-Alive] 58297  >  443 [ACK] Seq=1 Ack=1 Win=257 Len=1"
"2545","80.659735","3.233.149.199","192.168.75.216","TCP","54","[TCP Dup ACK 2542#1] 443  >  58279 [ACK] Seq=688 Ack=4796 Win=753 Len=0"
"2546","81.084730","35.171.96.214","192.168.75.216","TCP","54","[TCP Keep-Alive ACK] 443  >  58297 [ACK] Seq=1 Ack=2 Win=274 Len=0"
"2618","86.021016","74.125.200.188","192.168.75.216","TLSv1.2","507","Application Data"
"2619","86.071368","192.168.75.216","74.125.200.188","TCP","54","57907  >  5228 [ACK] Seq=2 Ack=454 Win=251 Len=0"
"2702","87.907665","192.168.75.216","52.98.66.98","TCP","55","[TCP Keep-Alive] 58048  >  443 [ACK] Seq=1 Ack=1 Win=252 Len=1"
"2706","88.037879","52.98.66.98","192.168.75.216","TCP","54","[TCP Keep-Alive ACK] 443  >  58048 [ACK] Seq=1 Ack=2 Win=264 Len=0"
"2711","91.147412","192.168.75.216","13.236.8.150","TLSv1.2","123","Application Data"
"2712","91.147545","192.168.75.216","13.236.8.150","TLSv1.2","93","Application Data"
"2714","91.539627","13.236.8.150","192.168.75.216","TCP","54","443  >  58221 [ACK] Seq=84 Ack=218 Win=222 Len=0"
"2715","91.539627","13.236.8.150","192.168.75.216","TLSv1.2","93","Application Data"
"2716","91.540341","13.236.8.150","192.168.75.216","TLSv1.2","177","Application Data"
"2717","91.540383","192.168.75.216","13.236.8.150","TCP","54","58221  >  443 [ACK] Seq=218 Ack=246 Win=255 Len=0"
"2718","92.087558","192.168.75.216","52.71.28.102","TCP","55","[TCP Keep-Alive] 58005  >  443 [ACK] Seq=1 Ack=1 Win=255 Len=1"
"2720","92.128131","52.71.28.102","192.168.75.216","TCP","54","[TCP Keep-Alive ACK] 443  >  58005 [ACK] Seq=1 Ack=2 Win=170 Len=0"
"3183","93.347437","192.168.75.216","108.138.141.32","TCP","55","[TCP Keep-Alive] 58294  >  443 [ACK] Seq=1 Ack=1 Win=253 Len=1"
"3184","93.445974","108.138.141.32","192.168.75.216","TCP","54","[TCP Keep-Alive ACK] 443  >  58294 [ACK] Seq=1 Ack=2 Win=173 Len=0"
"3186","94.957588","18.211.189.31","192.168.75.216","TLSv1.2","85","Application Data"
"3187","94.957893","192.168.75.216","18.211.189.31","TLSv1.2","89","Application Data"
"3188","95.000463","18.211.189.31","192.168.75.216","TCP","54","443  >  58216 [ACK] Seq=98 Ack=105 Win=190 Len=0"
"3189","96.143144","192.168.75.216","157.240.208.60","TLSv1.2","85","Application Data"
"3191","96.397709","157.240.208.60","192.168.75.216","TCP","54","443  >  58281 [ACK] Seq=156 Ack=158 Win=981 Len=0"
"3193","96.496379","157.240.208.60","192.168.75.216","TLSv1.2","92","Application Data"
"3200","96.545899","192.168.75.216","157.240.208.60","TCP","54","58281  >  443 [ACK] Seq=158 Ack=194 Win=253 Len=0"
"3201","96.781065","192.168.75.216","3.232.39.161","TCP","55","[TCP Keep-Alive] 58299  >  443 [ACK] Seq=0 Ack=65 Win=255 Len=1"
"3214","97.142049","3.232.39.161","192.168.75.216","TCP","54","[TCP Keep-Alive ACK] 443  >  58299 [ACK] Seq=65 Ack=1 Win=149 Len=0"
"3281","100.519263","192.168.75.216","20.205.243.166","TCP","55","[TCP Keep-Alive] 58284  >  443 [ACK] Seq=0 Ack=41 Win=256 Len=1"
"3284","101.153037","20.205.243.166","192.168.75.216","TCP","54","[TCP Keep-Alive ACK] 443  >  58284 [ACK] Seq=41 Ack=1 Win=149 Len=0"
"3286","102.935047","192.168.75.216","3.225.133.12","TCP","55","[TCP Keep-Alive] 58302  >  443 [ACK] Seq=0 Ack=33 Win=253 Len=1"
"3292","102.980990","3.225.133.12","192.168.75.216","TCP","54","[TCP Keep-Alive ACK] 443  >  58302 [ACK] Seq=33 Ack=1 Win=178 Len=0"
"3371","105.947186","74.125.200.188","192.168.75.216","TLSv1.2","507","Application Data"
"3372","105.996489","192.168.75.216","74.125.200.188","TCP","54","57907  >  5228 [ACK] Seq=2 Ack=907 Win=257 Len=0"
"3383","108.151613","192.168.75.216","157.240.208.60","TLSv1.2","85","Application Data"
"3385","108.370780","157.240.208.60","192.168.75.216","TCP","54","443  >  58281 [ACK] Seq=194 Ack=189 Win=982 Len=0"
"3387","108.497380","157.240.208.60","192.168.75.216","TLSv1.2","92","Application Data"
"3441","108.557397","192.168.75.216","157.240.208.60","TCP","54","58281  >  443 [ACK] Seq=189 Ack=232 Win=253 Len=0"
"3443","109.166943","192.168.75.216","3.233.149.199","TLSv1.2","273","Application Data"
"3444","109.167110","192.168.75.216","3.233.149.199","TLSv1.2","100","Application Data"
"3445","109.167177","192.168.75.216","3.233.149.199","TLSv1.2","1358","Application Data"
"3446","109.613584","3.233.149.199","192.168.75.216","TCP","54","443  >  58279 [ACK] Seq=688 Ack=6365 Win=802 Len=0"
"3447","109.613584","3.233.149.199","192.168.75.216","TLSv1.2","100","Application Data"
"3448","109.613720","3.233.149.199","192.168.75.216","TLSv1.2","199","Application Data"
"3449","109.613720","3.233.149.199","192.168.75.216","TLSv1.2","92","Application Data"
"3450","109.613767","192.168.75.216","3.233.149.199","TCP","54","58279  >  443 [ACK] Seq=6365 Ack=917 Win=253 Len=0"
"3451","109.615737","192.168.75.216","3.233.149.199","TLSv1.2","96","Application Data"
"3452","110.187423","3.233.149.199","192.168.75.216","TCP","54","443  >  58279 [ACK] Seq=917 Ack=6407 Win=803 Len=0"
"3470","113.508700","192.168.75.216","185.199.108.133","TCP","55","[TCP Keep-Alive] 57953  >  443 [ACK] Seq=1 Ack=1 Win=257 Len=1"
"3527","114.173137","185.199.108.133","192.168.75.216","TCP","54","[TCP Keep-Alive ACK] 443  >  57953 [ACK] Seq=1 Ack=2 Win=206 Len=0"
"3533","114.751529","192.168.75.216","142.251.10.95","TCP","55","[TCP Keep-Alive] 58149  >  443 [ACK] Seq=1 Ack=1 Win=254 Len=1"
"3537","115.819743","142.251.10.95","192.168.75.216","TCP","54","[TCP Keep-Alive ACK] 443  >  58149 [ACK] Seq=1 Ack=2 Win=149 Len=0"
"3538","115.826252","192.168.75.216","20.96.88.162","TCP","55","[TCP Keep-Alive] 58300  >  443 [ACK] Seq=586 Ack=331 Win=256 Len=1"
"3539","117.048623","20.96.88.162","192.168.75.216","TCP","54","[TCP Keep-Alive ACK] 443  >  58300 [ACK] Seq=331 Ack=587 Win=967 Len=0"
"3540","117.586264","192.168.75.216","140.82.113.26","TCP","55","[TCP Keep-Alive] 58291  >  443 [ACK] Seq=58 Ack=51 Win=253 Len=1"
"3541","117.924610","192.168.75.216","185.199.108.154","TCP","55","[TCP Keep-Alive] 58282  >  443 [ACK] Seq=1 Ack=1 Win=255 Len=1"
"3542","117.928704","140.82.113.26","192.168.75.216","TCP","54","[TCP Keep-Alive ACK] 443  >  58291 [ACK] Seq=51 Ack=59 Win=212 Len=0"
"3543","119.096735","185.199.108.154","192.168.75.216","TCP","54","[TCP Keep-Alive ACK] 443  >  58282 [ACK] Seq=1 Ack=2 Win=149 Len=0"
"4001","122.508670","192.168.75.216","3.94.218.138","TCP","55","[TCP Keep-Alive] 58124  >  443 [ACK] Seq=1 Ack=1 Win=257 Len=1"
"4002","122.510226","74.125.200.188","192.168.75.216","TLSv1.2","511","Application Data"
"4003","122.556562","192.168.75.216","74.125.200.188","TCP","54","57907  >  5228 [ACK] Seq=2 Ack=1364 Win=255 Len=0"
"4004","122.580677","3.94.218.138","192.168.75.216","TCP","54","[TCP Keep-Alive ACK] 443  >  58124 [ACK] Seq=1 Ack=2 Win=249 Len=0"
"4005","122.751078","192.168.75.216","185.199.108.154","TCP","55","[TCP Keep-Alive] 58285  >  443 [ACK] Seq=1 Ack=1 Win=254 Len=1"
"4007","122.806233","185.199.108.154","192.168.75.216","TCP","54","[TCP Keep-Alive ACK] 443  >  58285 [ACK] Seq=1 Ack=2 Win=199 Len=0"
"4019","123.551236","192.168.75.216","34.193.113.164","TCP","55","[TCP Keep-Alive] 58125  >  443 [ACK] Seq=1 Ack=1 Win=256 Len=1"
"4021","124.579421","34.193.113.164","192.168.75.216","TCP","54","[TCP Keep-Alive ACK] 443  >  58125 [ACK] Seq=1 Ack=2 Win=320 Len=0"
"4022","124.716573","192.168.75.216","35.171.96.214","TCP","55","[TCP Keep-Alive] 58296  >  443 [ACK] Seq=1 Ack=1 Win=257 Len=1"
"4025","124.757730","35.171.96.214","192.168.75.216","TCP","54","[TCP Keep-Alive ACK] 443  >  58296 [ACK] Seq=1 Ack=2 Win=274 Len=0"
"4078","125.298245","192.168.75.216","35.171.96.214","TCP","55","[TCP Keep-Alive] 58298  >  443 [ACK] Seq=1 Ack=1 Win=256 Len=1"
"4079","126.091421","192.168.75.216","35.171.96.214","TCP","55","[TCP Keep-Alive] 58297  >  443 [ACK] Seq=1 Ack=1 Win=257 Len=1"
"4080","126.095844","35.171.96.214","192.168.75.216","TCP","54","[TCP Keep-Alive ACK] 443  >  58298 [ACK] Seq=1 Ack=2 Win=151 Len=0"
"4081","126.095844","157.240.208.60","192.168.75.216","TLSv1.2","160","Application Data"
"4082","126.147688","192.168.75.216","157.240.208.60","TCP","54","58281  >  443 [ACK] Seq=189 Ack=338 Win=253 Len=0"
"4083","126.152480","35.171.96.214","192.168.75.216","TCP","54","[TCP Keep-Alive ACK] 443  >  58297 [ACK] Seq=1 Ack=2 Win=274 Len=0"
"4146","131.147875","192.168.75.216","20.96.88.162","TLSv1.2","126","Application Data"
"4147","131.148027","192.168.75.216","20.96.88.162","TLSv1.2","100","Application Data"
"4148","131.148091","192.168.75.216","20.96.88.162","TLSv1.2","231","Application Data"
"4150","131.322371","20.96.88.162","192.168.75.216","TCP","54","443  >  58300 [ACK] Seq=331 Ack=705 Win=970 Len=0"
"4151","131.322371","20.96.88.162","192.168.75.216","TCP","54","443  >  58300 [ACK] Seq=331 Ack=882 Win=976 Len=0"
"4152","132.520746","20.96.88.162","192.168.75.216","TLSv1.2","100","Application Data"
"4153","132.520746","20.96.88.162","192.168.75.216","TLSv1.2","96","Application Data"
"4154","132.520913","192.168.75.216","20.96.88.162","TCP","54","58300  >  443 [ACK] Seq=882 Ack=419 Win=256 Len=0"
"4155","132.521468","20.96.88.162","192.168.75.216","TLSv1.2","131","Application Data"
"4156","132.521468","140.82.113.26","192.168.75.216","TLSv1.2","79","Application Data"
"4157","132.521553","20.96.88.162","192.168.75.216","TCP","100","[TCP Spurious Retransmission] 443  >  58300 [ACK] Seq=331 Ack=882 Win=976 Len=46"
"4158","132.521584","192.168.75.216","20.96.88.162","TCP","66","58300  >  443 [ACK] Seq=882 Ack=496 Win=255 Len=0 SLE=331 SRE=377"
"4159","132.522470","192.168.75.216","140.82.113.26","TLSv1.2","83","Application Data"
"4160","133.007452","192.168.75.216","140.82.113.26","TCP","83","[TCP Retransmission] 58291  >  443 [PSH, ACK] Seq=59 Ack=76 Win=253 Len=29"
"4161","133.011354","20.96.88.162","192.168.75.216","TCP","131","[TCP Spurious Retransmission] 443  >  58300 [PSH, ACK] Seq=419 Ack=882 Win=976 Len=77"
"4162","133.011354","140.82.113.26","192.168.75.216","TCP","54","443  >  58291 [ACK] Seq=76 Ack=88 Win=213 Len=0"
"4163","133.011444","192.168.75.216","20.96.88.162","TCP","66","[TCP Dup ACK 4158#1] 58300  >  443 [ACK] Seq=882 Ack=496 Win=255 Len=0 SLE=419 SRE=496"
"4164","133.042058","192.168.75.216","52.98.66.98","TCP","55","[TCP Keep-Alive] 58048  >  443 [ACK] Seq=1 Ack=1 Win=252 Len=1"
"4165","133.063522","140.82.113.26","192.168.75.216","TCP","54","[TCP Dup ACK 4162#1] 443  >  58291 [ACK] Seq=76 Ack=88 Win=213 Len=0"
"4166","133.270525","52.98.66.98","192.168.75.216","TCP","54","[TCP Keep-Alive ACK] 443  >  58048 [ACK] Seq=1 Ack=2 Win=264 Len=0"
"4226","136.545661","192.168.75.216","13.236.8.150","TCP","55","[TCP Keep-Alive] 58221  >  443 [ACK] Seq=217 Ack=246 Win=255 Len=1"
"4227","137.129858","192.168.75.216","52.71.28.102","TCP","55","[TCP Keep-Alive] 58005  >  443 [ACK] Seq=1 Ack=1 Win=255 Len=1"
